"Boroplus Body Lotion Provides 24Hrs Moisturisation 100% Ayurvedic Lotion, Vitamin E For Dry And Normal Skin With Goodness Of Dhoodh, Badam & Kesar, 400Ml",₹203.00,₹203.00,4.2 out of 5 stars,N/A,N/A,4.2 out of 5 stars,"Boroplus Body Lotion Provides 24Hrs Moisturisation 100% Ayurvedic Lotion, Vitamin E For Dry And Normal Skin With Goodness Of Dhoodh, Badam & Kesar, 400Ml",N/A,bestsellers,"['https://images-eu.ssl-images-amazon.com/images/I/612zhIOKqFL._AC_UL300_SR300,200_.jpg']"
Minimalist 10% Vitamin B5 Gel Face Moisturizer For Oily & Acne Prone Skin | Oil-free | Fast Absorbing Lightweight Winter Cream For Women & Men | Non sticky | Fragrance Free,₹349.00,₹349.00,4.1 out of 5 stars,N/A,N/A,4.1 out of 5 stars,Minimalist 10% Vitamin B5 Gel Face Moisturizer For Oily & Acne Prone Skin | Oil-free | Fast Absorbing Lightweight Winter Cream For Women & Men | Non sticky | Fragrance Free,N/A,bestsellers,"['https://images-eu.ssl-images-amazon.com/images/I/51Sy8ktByyL._AC_UL300_SR300,200_.jpg']"
"Deconstruct Face Gel Sunscreen SPF 50 + and PA+++ | Gel based sunscreen for oily skin, combination skin, normal skin | Broad spectrum sunscreen, No White Cast, Lightweight, Non greasy - 50g",₹331.00,₹331.00,4.1 out of 5 stars,N/A,N/A,4.1 out of 5 stars,"Deconstruct Face Gel Sunscreen SPF 50 + and PA+++ | Gel based sunscreen for oily skin, combination skin, normal skin | Broad spectrum sunscreen, No White Cast, Lightweight, Non greasy - 50g",N/A,bestsellers,"['https://images-eu.ssl-images-amazon.com/images/I/51VLdPNtSWL._AC_UL300_SR300,200_.jpg']"
WishCare Tinted Lip Balm with SPF 50 PA+++ - Brightening Lip Balm for Dark Lips with Kojic Acid & Niacinamide- SPF lip balm for Women 5g,₹224.00,₹224.00,4.2 out of 5 stars,N/A,N/A,4.2 out of 5 stars,WishCare Tinted Lip Balm with SPF 50 PA+++ - Brightening Lip Balm for Dark Lips with Kojic Acid & Niacinamide- SPF lip balm for Women 5g,N/A,bestsellers,"['https://images-eu.ssl-images-amazon.com/images/I/710g+cQQxML._AC_UL300_SR300,200_.jpg']"
"Khadi Natural Amla & Bhringraj Shampoo/Cleanser for Controlling Dandruff & Hair fall | Shampoo for Reducing Scalp Irritation | Paraben & Sulphate-Free | Suitable for All Hair Types, 210ml",₹199.00,₹199.00,3.9 out of 5 stars,N/A,N/A,3.9 out of 5 stars,"Khadi Natural Amla & Bhringraj Shampoo/Cleanser for Controlling Dandruff & Hair fall | Shampoo for Reducing Scalp Irritation | Paraben & Sulphate-Free | Suitable for All Hair Types, 210ml",N/A,bestsellers,"['https://images-eu.ssl-images-amazon.com/images/I/61vWAbbZjVL._AC_UL300_SR300,200_.jpg']"
"Cetaphil Moisturising Cream for Face & Body , Dry to Normal skin, 80 gm",₹541.00,₹541.00,4.3 out of 5 stars,N/A,N/A,4.3 out of 5 stars,"Cetaphil Moisturising Cream for Face & Body , Dry to Normal skin, 80 gm",N/A,bestsellers,"['https://images-eu.ssl-images-amazon.com/images/I/61pK4c7UNiL._AC_UL300_SR300,200_.jpg']"
Alps Goodness Rosemary Water Spray For Hair Growth (200 ml) | Hair Spray for Regrowth | Rosemary Hair Mist | Adds Shine | Helps Reduce Hairfall | Strengthens Hair | Suitable For All Hair Types,₹302.00,₹302.00,4.1 out of 5 stars,N/A,N/A,4.1 out of 5 stars,Alps Goodness Rosemary Water Spray For Hair Growth (200 ml) | Hair Spray for Regrowth | Rosemary Hair Mist | Adds Shine | Helps Reduce Hairfall | Strengthens Hair | Suitable For All Hair Types,N/A,bestsellers,"['https://images-eu.ssl-images-amazon.com/images/I/71mOu-ekpFL._AC_UL300_SR300,200_.jpg']"
"Maybelline New York Matte Lipstick, Intense Colour, Keeps Lips Moisturised, 657 Nude Nuance, Color Sensational Creamy Matte Lipstick, 3.9g",₹181.00,₹181.00,4.1 out of 5 stars,N/A,N/A,4.1 out of 5 stars,"Maybelline New York Matte Lipstick, Intense Colour, Keeps Lips Moisturised, 657 Nude Nuance, Color Sensational Creamy Matte Lipstick, 3.9g",N/A,bestsellers,"['https://images-eu.ssl-images-amazon.com/images/I/51Fs39k8fCL._AC_UL300_SR300,200_.jpg']"
"Deconstruct Brightening Lip Balm with SPF 30 | For Dark, Pigmented, Dry, Flaky Lips | Brightens Pigmented Lips | Vitamin C for Dark Lips | SPF 30 for Sun Damage and Discoloration | Lip Balm for Glossy Buttery Soft Pink Lips | For Women & Men - (4 gm)",₹193.00,₹193.00,3.9 out of 5 stars,N/A,N/A,3.9 out of 5 stars,"Deconstruct Brightening Lip Balm with SPF 30 | For Dark, Pigmented, Dry, Flaky Lips | Brightens Pigmented Lips | Vitamin C for Dark Lips | SPF 30 for Sun Damage and Discoloration | Lip Balm for Glossy Buttery Soft Pink Lips | For Women & Men - (4 gm)",N/A,bestsellers,"['https://images-eu.ssl-images-amazon.com/images/I/61RqBeyLnML._AC_UL300_SR300,200_.jpg']"
